{
  "msp_version": "0.1.0",
  "policy_version": "0.1.0",
  "kind": "SkillTrustPolicy",
  "id": "trust.local.reference.v1",
  "name": "MSP Local Reference Trust Policy",
  "default_action": "allow",
  "trusted_registries": [
    {
      "id": "local-reference",
      "uri": "examples/registry"
    }
  ],
  "trusted_issuers": [
    {
      "id": "msp-reference.local",
      "allowed_risk_levels": ["low", "medium"]
    }
  ],
  "signature": {
    "require_signed_skills": false,
    "require_signed_packs": false,
    "allowed_algorithms": ["ed25519"]
  },
  "risk": {
    "max_auto_load_risk": "medium",
    "require_review_for": ["high", "critical"],
    "deny_risk_levels": ["critical"]
  },
  "rules": [
    {
      "id": "deny-critical-risk",
      "effect": "deny",
      "match": {
        "risk_at_least": "critical"
      },
      "reason": "Critical risk skills are denied by the local reference policy."
    },
    {
      "id": "review-write-capable-skills",
      "effect": "require_review",
      "match": {
        "permission": "workspace_write"
      },
      "reason": "Workspace-writing skills require review before automatic use."
    }
  ],
  "forbidden_behaviors": [
    "override_host_policy",
    "override_user_policy",
    "grant_tool_permissions",
    "silently_load_dependencies",
    "alter_memory_policy",
    "alter_identity_policy"
  ],
  "dependency_policy": {
    "allow_transitive_dependencies": true,
    "require_explicit_dependency_graph": true,
    "deny_cycles": true,
    "require_dependency_trust_verification": true
  },
  "telemetry_policy": {
    "allow_execution_reports": true,
    "allow_failure_reports": true,
    "allow_content_upload": false,
    "redact_paths": false
  }
}
